{
  "version": 1,
  "defaultProfile": "standard",
  "profiles": [
    "minimal",
    "standard",
    "full"
  ],
  "minimalSkills": [
    "agent-sort",
    "api-design",
    "backend-patterns",
    "codebase-onboarding",
    "coding-standards",
    "configure-ecc",
    "context-budget",
    "documentation-lookup",
    "e2e-testing",
    "ecc-guide",
    "error-handling",
    "eval-harness",
    "frontend-patterns",
    "git-workflow",
    "mcp-server-patterns",
    "plan-canvas",
    "security-review",
    "skill-stocktake",
    "strategic-compact",
    "tdd-workflow",
    "unified-memory",
    "verification-loop"
  ],
  "groups": {
    "workflow-quality": "standard",
    "skill-unified-memory": "standard",
    "database": "standard",
    "security": "standard",
    "orchestration": "standard",
    "framework-language": "full",
    "optimization-workflows": "full",
    "research-apis": "full",
    "business-content": "full",
    "operator-workflows": "full",
    "prediction-market-skills": "full",
    "ito-compute": "full",
    "nasiko-control-plane": "full",
    "social-distribution": "full",
    "media-generation": "full",
    "swift-apple": "full",
    "agentic-patterns": "full",
    "devops-infra": "full",
    "machine-learning": "full",
    "supply-chain-domain": "full",
    "document-processing": "full"
  }
}
